{
    "apiVersion": "aipg.intel.com/v1",
    "kind": "BatchPrediction",
    "metadata": {
        "name": "batch-123"
    },
    "spec": {
      "state": "Completed",
      "resourceSpec": {
        "cpu": "3000m",
        "memory": "8Gi"
      },
      "repositories": [
        {
          "URL": "git@example.com:foo/bar.git",
          "commit": "v1.2.3"
        }
      ],
      "batchID": 1,
      "scriptFilePath": "batch_prediction.py",
      "modelWeightsS3URL": "s3://foo/bar/baz",
      "modelWeightsFileName": "weights.prm",
      "extraFilename": "foo.txt",
      "awsPath": "",
      "aWSDefaultRegion": ""
    },
    "status": {
        "state": "Running"
    }
}
